,text,people,process,product,system
226,"You didn't receive, somebody took my email I D haan, you didn't receive any claim form right now.",0,1,0,0
227,You have given me all the documents. What what else you want? What else you want? Still you don't want to trust me?,0,0,1,0
228,You know when I will get the message that you know how much money I am losing? I think you know Fifteenth Sixteenth I think it is,0,1,0,0
229,"You know, you have no powers. You have only powers to send me here and there. Sir, I will raise a request from my end Sir. You do it.",1,1,0,0
230,You people told me like you have sent out an mail right. Right Now. OK. But I have not received to my Inbox.,0,1,0,0
231,You the my it will be sent within three four days whatever. that time. And now one more message has come mail has come asking me to send again credit,0,1,0,0
232,Zero Double Two. sir I have to disconnect your call. One Nine Two Eight One Nine. there is no response from you Two Eight.,0,1,0,0
233,a insurance and so finally when i am trying to pay the rupees,0,1,0,0
234,a minute i just provide my passport number ok sir so long hello,0,1,0,0
235,a o where is this incident i told that you know total coverages should be there,0,0,1,0
236,a renewal and it is showing the policy not accept can you just provide me the,0,0,1,0
237,a same page of payment options and it is not going through ok did your payment has,0,1,0,0
238,a sorry third party proper damage plus on damage you have cover and plus add on cover nil dep,0,0,1,0
239,a that i want to confirm ok sir may i know your policy number sir? policy number i don't know you type just,0,0,1,0
240,a there was no just voluntree deductible of two thousand five hundred was there sir don't take voluntree de,0,0,1,0
241,a this is the one which i need to renew we renew yesterday only i got a mail,0,0,1,0
242,able to say what are the facility will I get. sorry sir I am not able to,0,1,0,0
243,accept buy online ok ok this is coming discounted plan it is showing,0,0,1,0
244,accident I have already lodged the police complain and I have got the copy of the police complaint as well.,0,0,0,1
245,actually i tried in that but it's it's asking for a garage location it is not allowing us to select the nearly garage location,0,1,0,0
246,actually i want to update the registered number on renewal payee,0,0,1,0
247,actually i was just inform you to this one ok settlement settlement is there no,0,1,0,0
248,actually it's not mentioned in the policy document. OK because I am seeing policy document I am confused little bit.,0,0,1,0
249,add on benefit is not available sir i see in my system it can't provide you can't provide,0,1,1,0
250,add voluntry deductable for two thousand fif two thousand five hundred slap the amount will be for,0,0,1,0
251,affiliated the nearest a garage I mean affiliated garage of yours where I can claim my policy today I have met with an ac.,0,1,0,0
252,after next year i don't getting new zero depreciation no no sir every year you got a,0,0,1,0
253,after selecting language you just press four and then two ok,1,0,0,0
254,after this call you will receive an S M S over there you need to feedback and share your feedback also. OK sure I will do that.,0,1,0,0
255,ah Suzuki vendor only just give me a minute I will get hello yes.,0,1,0,0
256,ah hospitals will be receiving the auto generated email when they are OK sending.,0,1,0,0
257,ah yeah where they have asked me to choose the five i don't understand what is that request,0,1,0,0
258,all our cars are renewed from reliance only ok I have got four policies four vehicle,0,0,1,0
259,all the documents will be shared surveyor and he will proceed ok ok ok acha acha because it is a new bike,0,0,1,0
260,"already have been renewed. It is not taking in the issue. OK., So May I know your",0,0,1,0
261,also four thousand rupees which is these are out from our side as it is not payable sir. then why i will,0,1,1,0
262,am i audible to you? yeah yeah some sort of disturbance is there ok no problem.,0,0,0,1
263,and electro electronic access is zero and non electrical access is zero zero what is this sir i don't understand,0,0,1,0
264,and for the bike it is a comprehensive policy only i believe,0,0,1,0
265,and if your policy will be bumper to bumper no so there is no no need to pay bumper to bumper,0,0,1,0
266,and my existing policy also expire today what will i do i can under you guys are not giving me anything in the writing that ok we will,0,0,1,0
267,and now they are saying this your claim can not be given this is not fair so why I i was invested thirteen thousand rupees,0,1,0,0
268,and the policy name is a is in my father's name but he died the three months back,0,0,1,0
269,and you need to update the garage details. OK OK then only our survey manager will visit the vehicle all right.,1,0,0,0
270,and your total premium amount is sum up two five thousand sixty eight rupees including g s t sir ok foryt two,0,0,1,0
271,any claim any claim i have told them now they when i am going to take a claim from reliance,0,1,0,0
272,any communication from Reliance ok i thought it is resolved last week i met with an accident,0,1,0,0
273,any issue of the premium or you can not calculate in this premium of your policy no no,0,0,1,0
274,anything I mean at the time of accident you need to call this number and you need to intimate that claim then only your survey manager will req.,1,1,0,0
275,"are not coming on line to talk to me. And inspite of all these things, you gave me a",0,1,0,0
276,as per common law which are the co decided that yes that will be pay by by company ok,0,1,0,0
277,as you click on that the details page will be open yeah the page open yeah the first it is written,0,0,1,0
278,b b eight six nine eight yeah i d v value for the current year is one lakh fifty two thousand,0,0,1,0
279,back response system. sure sure why not why not why not why not why not yes Bhaskar sir. please.,0,1,0,0
280,back there also ok hard copy haan sir for travel policy hard.,0,1,0,0
281,bata deta hoon zero dep policy rahega na haan zero depreciation with road side assistance vagerah,0,0,1,0
282,be eleven thousand two thirty so i wanted to know what is the coverage the last coverages you want,0,0,1,0
283,be mention that starts from R Three. R Three the message I D starts from R Three.,0,1,0,0
284,be online i will calculate the payment just be online yeah yeah just be online shall i give me my user i d and,0,1,0,0
285,because sir i mean rule of company sir minimum three year and maximum five year add on and add on cover benefit,0,0,1,0
286,because they were behaving like the same way you are behaving now today I have I have a problem from last one week my car is,1,0,0,0
287,because you are trying to renew this policy from website na yeah so the website will be,0,0,1,0
288,been an hour OK i will check with after that i didn't get a call that is why i am dealing here OK not an issue mam as,0,1,0,0
289,before that can you explain me about the plan what coverages that you are yes i explain you our,0,0,1,0
290,below sixty is not taking me ok ok that is why i wanted to know what is the amount that will be,0,0,1,0
291,bumper to bumper third party own damage or bumper to bumper yeh teeno ke liye kitna hoga bolo aap,0,0,1,0
292,"but  he never does.I have sent him so many messages. Sir, do you want to register a Complaint on him?",0,1,0,1
293,but for the current year you will get fifteen lakh rupees covered for the owner driver so that's,0,0,1,0
294,but he was not answering my calls no nee has he ever tried to call me up. Sorry that. So that's why I have to call you,0,1,0,0
295,but i am just unable to understand that change the premium should go down every year.,0,0,1,0
296,but i don't remember my name that's why but i am sorry sir sorry mam i won't be able to connect you with the S,0,0,0,1
297,but the policy is rejected can you what is the reason for,0,0,1,0
298,but we can't cover this vehicle because the vehicle is fifteen year old more than fifteen year old,0,0,1,0
299,but what the discount quote i have make for you in this policy there is a discount like,0,0,1,0
300,but you have to provide me the message I D sir that provide I don't know what is message I D they will given me a reference number which I give.,0,1,0,0
301,by visiting the branch and four thing is become a agent but i do not allow you to,1,0,0,0
302,c e o also i have written to imbursement also regarding that i have head of grievence also i have written to them,0,1,0,0
303,call back arrangement for your vehicle they will no no no call you no no for that also we can do it now only but what i am saying now is you need to give me information,0,1,0,0
304,call back to you. Then few minutes you will you will get a call back. OK. We assist further. Thanks.,0,1,0,0
305,call can go to any number of customer agent so what i am trying to say now is yesterday i could not get,1,0,0,0
306,call i will got the email yeah no issue sir you disconnnect the call after the confirm payement naa i will call you for the confirmation,0,1,0,0
307,call that is the that person is the patient yes and I can't expect him to call and you have my policy,0,1,0,0
308,call the concern department who help you out in a better way. you guys are just wasting my time seriously i last time i called you upon.,1,0,0,0
309,call. This arranging call back has happened from last so many days. He never called me up. Everytime I need,1,1,0,0
310,called half an hour back. I gave the same id and he could find it. and You are not able to find it.,0,1,0,0
311,called now. I have missed the cheque like yio have asked for.,0,1,0,0
312,"calling the number to do some changes. There was a error, while you know doing the",0,1,0,0
313,came a thirty six including nil depreciation and all thirty six did you select any kind of hidden discount,0,1,1,0
314,can I give you the A L number? sir we have the ah claim details but we need send.,0,1,0,0
315,can i explain you the benefit and everything yeah sure ok so this is a bumper to bumper policy,0,0,1,0
316,can i give you the new policy so you want to case no written communication from all verbal communication is happening,0,1,1,0
317,can not be done because i have taken a no claim bonus and i have taken claim on previous this,0,1,1,0
318,can not visit a branch no sir we are unable why because this de this is dealer policy dealer policy has,1,0,0,0
319,can we cover it yes sir you can cover it somebody told me last year that it is not possible only third party insurance is possible,0,0,1,0
320,can you not give me some discount on no claim bonus or anything else sir no claim bonus,0,1,1,0
321,can you sir just tell me your email I D please  in for my date is going at have per cent eight,0,1,0,0
322,can you tell me the next premium thirty five thousand five hundred forty nine after g s t forty one thousand nine hundred forty eight right,0,0,1,0
323,can't you open the policy also. yes sir I. because somebody told me that only the dealer can open it you can not open it.,1,0,0,0
324,cancellation cheque or passbook. I have missed that during courier. I just want to know is there any online provision to upload that document.,0,1,1,0
325,cancellation or any trip delay or any loss of luggage you can claim for this policy OK. OK.,0,1,1,0
326,car i want to cover my car so for that do you tell me what can be done from your end sir wait a minute i am going to calculate and i will tell you,0,0,1,0
327,car insurance ok haan but when i am checking my previous policy number is,0,0,1,0
328,car the policy number is nine two zero two two ok one eight two three,0,0,1,0
329,card cardit card or net bank ok ok for three lakh rupees the premium would be seven thousand three hundred and six,0,1,1,0
330,care yeah I got this message I D only. yeah OK cloud Nine care.,0,1,0,0
331,case every passenger per passenger will be covered up to fifty thousand as per sitting cap,0,0,1,0
332,cess and you can upload the documents itself through the application itself then also you can check claim,0,1,1,0
333,cess. how long do you think is going to take? OK may I know when did the documents are sent to our end? final bill,0,0,1,0
334,cessfully i am sending a quotation or your email i d so mister Jayan if it is possible,0,1,1,0
335,"changes in. You are telling me but unnecessarily. Now I am telling you, you are telling me to go to website",0,0,0,1
336,check somebody sir we will. we have already I have already sent it I have already sent it in the first mail also discharge form is already there.,0,1,0,0
337,check with i will go through this policy accompany because if you can send me all the details to my mail i d suppose,0,1,0,0
338,checks is like this. That is why I am telling you. So this is absolutely I think wrong trans,0,0,1,0
339,chennai b c haan B C one two one two just give me one minute i will calculate it from my end i will checking your details,0,0,1,0
340,cheque. the date on the policy. sorry. started of the policy that policy have buyed,0,1,1,0
341,ciation policy no no no other insure that's what i am saying you any of the add on cover will not be given,0,0,1,0
342,claim a wrong no claim bonus of one two eight three ok ok where you have taken a,0,1,1,0
343,claim and I was told as i will received an S M S so the link and all that i didn't get any S M S i don't know my claim number i don't know anything and don't know what is going on,0,1,0,0
344,claim bonus so we have been asked to pay some amount to the company within Fif.,0,1,1,0
345,claim for that. that to know they are there to conditions there. yeah yes. right. OK is there anything else.,0,1,0,0
346,claim from Tata A I G I told that at that time also ki I have not taken any claim it was only a di,0,1,1,0
347,claim i don't know why company care company like reliance i shifted from tata to Reliance only because,0,1,0,0
348,claim if which was lesser i thought i will not take claim and take rather no claim bonus,0,1,1,0
349,claim is under testing since last Three hours we don't have an update yet.,0,1,0,0
350,claim number must be with p with hospital authority OK so I have the policy,0,1,0,0
351,claim of the thousand u s dollars ok ok that time they will give you the claim sir,0,1,0,0
352,claim taken on Two thousand eighteen while november yes i told them i have not taken any intrest,0,1,0,0
353,claim they will acha acha acha ok ok ok ok ok so today should I keep it with the bare,0,1,0,0
354,claim will be proce within One hour. OK so within One hour so some one will call me or I will have to call someone or I have to go to the T,0,1,0,0
355,claim. They only gave me this Reliance Insurance. OK. So what is the problem sir? I am not sure what is happ,0,1,0,0
356,claimed anything we have not claimed anything on basically the claim they are not claimed anything correct,0,1,0,0
357,cle i d v value is one lakh ninety eight thousand forty six rupees ok,0,0,1,0
358,cle is over aged and second thing it is comprehensive policy every any other company will give you a,0,0,1,0
359,cle the driver is covered owner driver is covered up fifteen lakhs in case of total dis,0,0,1,0
360,"come. Your senior, yesterday he gave the same reply to me that your senior was busy",1,0,0,0
361,comfortable to make the payment in online sir via debit card credit card or net banking yeah sure,0,1,0,0
362,coming he is not picking up the phone. he is not coming claim has been assigned to him.,1,1,0,0
363,common law or state law and four benefit means got for bit in case of to,0,0,1,0
364,company should not charge me penalty for that ok yes yes yes mam don't worry about that ha,0,1,0,0
365,concern manager he told me sir you renew it online and then you have been repeated obviously you can't do anything here.,0,0,1,0
366,copy ok this is second time from morning i am calling one hundred times i called sorry for the they inconveinience are saying some server.,0,1,0,1
367,copy to the police man you don't have to pay the fine ok i know i know i know i know ok and hard copy will be send on a communication address within a fif,0,1,0,0
368,correct ok no medical problems no history problelm yeah no medical i filled up all that yaar no medical no his,0,1,0,0
369,count sir on this because this is third party policy we are unable to do anything this is governmented rule,0,0,1,0
370,couple of time which has happened then you know i was promised that i will get a call but you guys don't call,0,1,0,0
371,cover and how much we have proposed to this can be done should be want to or mock to be after sending the document right.,0,0,1,0
372,covered accidental hospitalization are covered ok and normal normal existing condition,0,0,1,0
373,covered cover vehicle expenses or working two lakhs fifty thousand dollars of gold than time to go for it,0,0,1,0
374,covered for fif sorry the driver of this vehicle is also covered for fifteen lakhs,0,0,1,0
375,covered in third party policy you covered and the third party property damage covered and,0,0,1,0
376,cument has not opened here I am not able to open your policy documents so this.,0,0,1,0
377,cy and you say you said the provide thie is problem and i want the claim,0,1,0,0
378,cy yeah so i am trying to do a name change for the a  i mean a in this,0,1,1,0
379,dard one is silver one is gold one is platinum one is the basic plan ok ok in standard,0,0,1,0
380,date I mean sorry I can't able to change the date so we can able to only cancel the policy.,0,1,0,0
381,date means a month right. Is there is a mistake in that. So you can do one thing. You can cancel this,0,1,1,0
382,deductible amount what is the deductible amount where does it deducted from sir if you claim like,0,1,0,0
383,depreciation you are the adding depreciation adding no sir last year the i d v value is one lakh,0,0,1,0
384,discharges sir from us haa i know i made a complaint to i have written to reliance insurance,0,0,0,1
385,disconnected  disconnected then no one call that is the problem. so don't disconnect it directly connect it.,0,0,0,1
386,disconnected mam due to some issue then call back against same toll free number.,0,0,0,1
387,disconnected so tomorrow you can contact because the time is there shift timing is finished OK ok,0,1,0,0
388,discount sir even vehicle bumper to bumper and the third party total driver all covered you know  yeah driver is also,0,0,1,0
389,discounted amount and premium amount might be the oh he didn't I didn't ask for any discount of the he just take me the quotation amount,0,0,1,0
390,do like that I mean after getting the policy number please call this same number we will definitely intimate your claim. sure not a problem.,0,1,1,0
391,document which you have sended from message yeah we will able to check. where is mess message I D return?,0,1,1,0
392,documents but this video service call starts but no voice received from other side i am trying for last.,0,0,1,1
393,don't yeah yeah it's come at yeah just don't make the payment on that sir just a second,0,1,0,0
394,double three five six five double three five and who is this number yes to whom i need to call in this Bhar,0,1,0,0
395,double zero five six one five seven exactly sir this is your policy number put it on web,0,0,1,0
396,down the number ah claim number sorry what you want me to note down sir claim number,0,1,0,0
397,dred ninety nine hundred ninety seven rupees but for the same yeh kya yeh kya cover nil depreciation,0,0,1,0
398,during that period from the point i will make the payment and the actual insurance,0,1,0,0
399,each like for standard and silver plan it has one lakh u s dollars for gold and platinum,0,0,1,0
400,eight days Saturday Sunday is my off and they say surveyor have said ki this claim can not be processed because of,1,1,0,0
401,eight days of the travel no medical problem started no medical problem nothing that i just trying to,0,1,0,0
402,eight six zero zero eight zero zero eight yeah you want to keep same mobile number talking from the number,0,1,0,0
403,email deta hu dekh ke at gmail dot com ok ok,0,1,0,0
404,email id right now i don't have the mail id. OK Sir. I would like to let you know that.,0,1,0,0
405,engine cover sir ninety five percent yes engine cover engine cover is also there yes,0,0,1,0
406,escalate you to the senior department That's what I am requesting. Escalate it now. But  you,0,1,0,0
407,ess yeah last time i had told them that they should send it by courier service but they send it by,0,1,0,0
408,"expire, OK. I will definitely help you regarding that. The recently which I have taken what if you guys don't resolve my issue, then where will I go?",0,0,1,0
409,expired sir no no there was no any previous policy no no on claim,0,1,1,0
410,face you while intimaiton the claim hello yes sir. ah it is C G,0,1,0,0
411,feedback system it will take less than ten seconds you can rate me five if you satisfy the information i have provided to you,0,1,0,0
412,fifteen lakhs and that is a pre premium for that in three seventy five rupees and you have taken premium for the paid driver,0,0,1,0
413,fifteen ok ok ok yeah the let me know your no claim bonus you are getting,0,0,1,0
414,fifteen to sixteen i just made a one claim two thousand sixteen fifteen to sixteen right,0,1,0,0
415,fifty dollars would deducted from it fifty dollars from deducted from what yes sir whatever the claim amount would be,0,1,0,0
416,"fifty one, if I am right. Ok. Today again a message is coming asking me to send",0,1,0,0
417,fifty percent company will pay fifty percent ok if suppose there is a fiber glass,0,0,1,0
418,fifty two thousand ok ok you don't made any claim during the current year so you will get the thirty five percent,0,1,0,0
419,file for cashless settlement so is that slash of one I guess.,0,1,0,0
420,final discounted amount sir i will provide final discounted amount yes yes i am providing the max,0,0,1,0
421,first together a tell me the taught what will be there ok sir wait a minute for that you have a standard policy know fifty thousand,0,0,1,0
422,five fifteen lakh rupees ok this is for you right ok fine second benefit third party prop,0,0,1,0
423,five lakh thirty sixx thousand premium ok initiated road side assistance,0,0,1,0
424,five nine and the pre premium is one more sum assured platinum is sixteen,0,0,1,0
425,five that's it yes sir this is the claim number and also can you please note one ah,0,1,0,0
426,five zero one five nine. That is a B S N L number. I am not able to know you know usme apka phone nahi lag raha hai. I don't know why?,0,1,0,0
427,fix it only sir then you will take the vehicle to the garage you need to click on the link.,0,1,0,0
428,for a claim immediately they sent out an email for me. How it is possible? No sir there is a form.,0,1,0,0
429,for body how much coverage and third party cover is and all these are not mentioned here,0,0,1,0
430,for last year my premium was eleven thousand one hundred forty four ok sir,0,0,1,0
431,for personal accident to owner driver will be covered upto fifteen lakh one,0,0,1,0
432,for seven thousand eight hundred sixty six i paid the premium hello ok,0,0,1,0
433,for that is the reason i had not taken from you correct correct what the things are mendatory all the things i have mentioned from my,0,0,1,0
434,for that ok she a she asked me to mention her name when i call,0,1,0,0
435,for the claim intimation it is ok on now and like now to register the claim also for,0,1,0,0
436,for the current year ok yeah that twenty percentage is already depreciated so the premium will,0,0,1,0
437,for this year your premium amount is seven thousand five hundred thirty five hundred and thirty rupees sir sir your i d v value is about,0,0,1,0
438,for this. That's why the reason I am asking you please cancel this policy. OK. Cancel a policy issue a new policy.,0,1,0,0
439,for tomorrow. I am I understand sir. I will arrange callback within two hours. But  he will not,0,1,0,0
440,for unnamed passenger and also yeah for the driver so ok so the amount will be if any driver also any,0,0,1,0
441,for your vehicle that our company is offering you this year is three lakhs seven thousand nine hundred and fif,0,0,1,0
442,form you a priority depart it didn't get sorry for the inconvenience sir allow me last time,0,1,0,0
443,forty eight rupees so just just you have to just close that link ok i will just close,0,1,0,0
444,forty five ok and the no claim bonus is twenty percent as you took any of the claim of,0,1,1,0
445,forty one thousand six hundred fifty three rupees ok but when i made it online no it,0,0,1,0
446,forty one thousand sixty three rupees including nil depreciation yes bumper to bumper policy,0,0,1,0
447,four at gmail dot com at gmail dot com yeah ok and mobile number,0,1,0,0
448,four four seven zero even other agents have confirm me the same rate,1,0,0,0
449,four four seven zero you tell me that much no discount sir what if we co do the renewal tomorrow,0,0,1,0
450,four three nine right yes sixteen four yeah three nine yeah i i just saw this online i just got a quote,0,0,1,0
451,friend also driving your vehicle so he will also get coverage of one lakh rupees ok upto one lakh forty one thousand nine hundred,0,0,1,0
452,from agent right sir yeah it was my company who had bought it from yes yes.,1,0,0,0
453,from morning i am trying that's the reason i called you to send me the link again to pay for the premium amount,0,1,1,0
454,from my side. you are going for reimbursement or cashless can I know. no we will go for cashless only no,0,1,0,0
455,from no no sir any any thing no claim no claim naa sir ok,0,1,0,0
456,from our side Mister Momeen may I know. my side it's my side. I am raising a request it is taking some time.,0,1,0,0
457,from the site but they are sended that the file size is too small to be,0,0,0,1
458,from them. so that we are able to locate this mail. OK if they are saying that they have sent across mail.so how do we.,0,1,0,0
